PT,AU,BA,BE,GP,AF,BF,CA,TI,SO,SE,BS,LA,DT,CT,CY,CL,SP,HO,DE,ID,AB,C1,RP,EM,RI,OI,FU,FX,CR,NR,TC,Z9,U1,U2,PU,PI,PA,SN,EI,BN,J9,JI,PD,PY,VL,IS,PN,SU,SI,MA,BP,EP,AR,DI,D2,EA,PG,WC,SC,GA,UT,PM,OA,HC,HP,DA
J,"Maier, HR; Sayed, T; Lence, BJ",,,,"Maier, HR; Sayed, T; Lence, BJ",,,"Forecasting cyanobacterium Anabaena spp. in the River Murray, South Australia, using B-spline neurofuzzy models",ECOLOGICAL MODELLING,,,English,Article; Proceedings Paper,2nd international Conference on Applications of Machine Learning to Ecological Modelling,"NOV 27-DEC 02, 2000","ADELAIDE, AUSTRALIA",,,B-spline associative memory network; fuzzy neural network; water quality; cyanobacteria (Blue-Green algae); forecasting,ARTIFICIAL NEURAL NETWORKS; WATER-QUALITY; PREDICTION; ALGORITHM; ECOSYSTEMS; ASMOD; FISH,"Recently, artificial neural network (ANN) methods have been used successfully for ecological modelling. In most instances, multi layer perceptrons (MLPs) that are trained with the back-propagation algorithm have been used. The major shortcoming of this approach is that the knowledge contained in the trained networks is difficult to interpret. One way to increase model transparency is to use neurofuzzy approaches, which enable the information that is stored in trained networks to be expressed in the form of a fuzzy rule base. In this paper, B-spline associative memory networks (AMNs), which have been shown to be learning equivalent to certain types of fuzzy models, are used to forecast concentrations of the cyanobacterium Anabaena spp. in the River Murray at Morgan, South Australia, 4 weeks in advance. The ASMOD (adaptive spline modeling of observation data) algorithm is used to optimise the model structure and the number of model inputs. The sensitivity of the model to the order of the basis functions and a number of stopping criteria is investigated. The performance of the various models is assessed in terms of forecasting accuracy and model transparency, and compared with that of a MLP model developed in a previous study. It is found that lower order basis functions and Bayes' Information Criterion (BIC) give the best model performance, both in terms of forecasting accuracy and transparency. The accuracy of the forecasts obtained using the B-spline AMN and MLP models is comparable, although the AMN may be considered to perform marginally better overall. In addition, the AMN provides more explicit information about the relationship between the model inputs and outputs. The fuzzy rules obtained from the AMN model suggest that incidences of Anabaena spp. generally occur after the passing of a flood hydrograph and when water temperatures are high. (C) 2001 Elsevier Science B.V. All rights reserved.",,,,"Maier, Holger R/B-9639-2008","Maier, Holger R/0000-0002-0277-6887; Sayed, Tarek/0000-0001-8797-0541",,,,,21,22,0,2,,,,0304-3800,,,ECOL MODEL,Ecol. Model.,1-Dec,2001,146,3-Jan,,,SI,,85,96,,10.1016/S0304-3800(01)00298-8,,,,Ecology,,,WOS:000172947900008,,,,,
J,"Walter, M; Recknagel, F; Carpenter, C; Bormans, M",,,,"Walter, M; Recknagel, F; Carpenter, C; Bormans, M",,,Predicting eutrophication effects in the Burrinjuck Reservoir (Australia) by means of the deterministic model SALMO and the recurrent neural network model ANNA,ECOLOGICAL MODELLING,,,English,Article; Proceedings Paper,2nd international Conference on Applications of Machine Learning to Ecological Modelling,"NOV 27-DEC 02, 2000","ADELAIDE, AUSTRALIA",,,deterministic model; recurrent neural network model; algal blooms; early warning; eutrophication; strategic control; scenario analysis; sensitivity analysis,TIME,"Two modelling paradigms were applied to the prediction of phytoplankton abundance in the Burrinjuck Reservoir: the deductive model SALMO and the inductive model ANNA. While SALMO is driven by process-based differential equations, the model ANNA is designed as recurrent feedforward neural network trained by time series data. Predictions of chlorophyll-a for the years 1979-1982 by both models were validated by means of measured data. Results showed that SALMO is able to predict annual average trends not only of chlorophyll-a but other chemical and biological state variables as well. It supports decision making by evaluating alternative scenarios for strategic eutrophication control. The model ANNA achieved reasonable accuracy in predicting timing and magnitudes of algal biomass up to 7 days ahead. The recurrent feedforward architecture of ANNA proved to be most efficient in order to model and predict seasonal dynamics of chlorophyll-a and its forecasting results can be utilized for early warning and tactical control of algal blooms in freshwater lakes. A sensitivity analysis conducted by ANNA revealed that algal abundance in Burrinjuck Reservoir is not only driven by physical and chemical characteristics of the water body but to a large extend by hydrological characteristics such as water depth as well. (C) 2001 Elsevier Science B.V. All rights reserved.",,,,,"Bormans, Myriam/0000-0002-4755-6327",,,,,31,36,0,9,,,,0304-3800,,,ECOL MODEL,Ecol. Model.,1-Dec,2001,146,3-Jan,,,SI,,97,113,,10.1016/S0304-3800(01)00299-X,,,,Ecology,,,WOS:000172947900009,,,,,
J,"Recknagel, F",,,,"Recknagel, F",,,Applications of machine learning to ecological modelling,ECOLOGICAL MODELLING,,,English,Article; Proceedings Paper,2nd international Conference on Applications of Machine Learning to Ecological Modelling,"NOV 27-DEC 02, 2000","ADELAIDE, AUSTRALIA",,,machine learning; ecological modelling; artificial neural network; genetic algorithm; multivariate statistics; time-series modelling; model hybridization; knowledge discovery; adaptive agents,ARTIFICIAL NEURAL-NETWORK; ADAPTIVE AGENTS; CLASSIFICATION,"The paper provides a summary of paper presentations at the 2nd International Conference on Applications of Machine Learning to Ecological Modelling and a preview of forthcoming developments in this area. Artificial neural networks were demonstrated to be very useful for nonlinear ordination and visualization of ecological data by Kohonen networks, and ecological time-series modelling by recurrent networks. Genetic algorithms proved to be very innovative for hybridizing deductive models, and evolving predictive rules, process equations and parameters. Newly emerging adaptive agents provide a novel framework for the discovery and forecasting of emergent ecosystem structures and behaviours in response to environmental changes. (C) 2001 Elsevier Science B.V. All rights reserved.",,,,,,,,,,101,107,1,18,,,,0304-3800,,,ECOL MODEL,Ecol. Model.,1-Dec,2001,146,3-Jan,,,SI,,303,310,,10.1016/S0304-3800(01)00316-7,,,,Ecology,,,WOS:000172947900026,,,,,
J,"Lorimer, CG; Dahir, SE; Nordheim, EV",,,,"Lorimer, CG; Dahir, SE; Nordheim, EV",,,Tree mortality rates and longevity in mature and old-growth hemlock-hardwood forests,JOURNAL OF ECOLOGY,,,English,Article,,,,,,forest models; old-growth definitions; population sustainability; tree life tables,SELF-THINNING RULE; ACER-SACCHARUM; NORTHERN HARDWOODS; DECIDUOUS FOREST; DYNAMICS; DISTURBANCE; WISCONSIN; FREQUENCY; MODELS; STAND,"1 Efforts to understand and forecast tong-term forest dynamics are often hindered by limited data on mortality rates and longevity of trees in older stands. In this study, mortality data were analysed from 11-year permanent plot records in 10 tracts of hemlock-hardwood forest with little past human disturbance in the upper Great Lakes region, USA. 2 We compared tree size-mortality trends in mature stands (canopy trees mostly 100-170 years old) with those in true old-growth stands (canopy trees mostly 200-350 years old). Stem sections were also cut from 71 recently fallen trees to determine average and maximum longevity for canopy trees of each species. 3 All five mature stands had descending monotonic size-mortality trends for shade-tolerant species, with low rates of mortality (generally much less than 1% per year) for trees > 18 cm d.b.h. In contrast, all five old-growth stands had U-shaped mortality functions, with annual mortality rates of 1.5-2.9% for trees > 66 cm d.b.h. These size-mortality trends are biologically consistent with 'rotated sigmoid' size distributions observed for major species, although mortality rates were nearly size-invariant for trees between 18 and 66 cm d.b.h. 4 Both late-successional and gap-phase species had fairly high mortality rates for saplings (2-10 cm d.b.h.) of 25-34% over the 11-year period, which suggests that size distributions with moderately steep negative slopes are needed to compensate for mortality and ensure population sustainability. 5 Average age at time of death for canopy trees was 216 years for sugar maple (Acer saccharum) and 301 years for hemlock (Tsuga canadensis), suggesting that the biological transition from mature to old-growth forest probably doesn't occur on these sites until a stand age of about 180-250 years.",,,,,,,,,,115,120,2,26,,,,0022-0477,,,J ECOL,J. Ecol.,DEC,2001,89,6,,,,,960,971,,10.1046/j.0022-0477.2001.00619.x,,,,Plant Sciences; Ecology,,,WOS:000172926100005,,,,,
J,"Ambroise, C; Grandvalet, Y",,,,"Ambroise, C; Grandvalet, Y",,,Prediction of ozone peaks by mixture models,ECOLOGICAL MODELLING,,,English,Article,,,,,,pollution; mixture model,,"This paper applies recent developments of mixture models to the prediction of peak episodes of ozone in Lyon (a major French city). Forecasting for the next day should be available at 14:00 h GMT. One day ahead prediction of such events allow public authorities to warn the population of the danger of outdoor exercises and activities. Compared td a standard discrimination problem, the database has many unusual characteristics among which missing measurements and missing decisions. Ail this peculiarities are well taken into account by mixture models, which additionally allow class densities to have complex shapes and decision boundaries to be non-linear. The proposed approach is compared to the persistence method, which consists in forecasting the same decision as the day before. The results show that mixture models outperform this simple predictor and offer the advantage of properly handling the missing labels and data. (C) 2001 Elsevier Science B.V. All rights reserved.",,,,,"Grandvalet, Yves/0000-0002-5645-5149",,,,,4,4,0,2,,,,0304-3800,,,ECOL MODEL,Ecol. Model.,15-Nov,2001,145,3-Feb,,,,,275,289,,10.1016/S0304-3800(01)00399-4,,,,Ecology,,,WOS:000172668200014,,,,,
J,"Rinaldi, S; Candaten, M; Casagrandi, R",,,,"Rinaldi, S; Candaten, M; Casagrandi, R",,,Evidence of peak-to-peak dynamics in ecology,ECOLOGY LETTERS,,,English,Article,,,,,,nonlinear dynamics; chaos; quasiperiodic behaviour; models; peak-to-peak dynamics; populations; forecast; strange attractors; fractal dimension; extreme episodes,CHAOTIC TIME-SERIES; POPULATION-DYNAMICS; STRANGE ATTRACTOR; FOOD-CHAIN; SYSTEMS; MODELS; BEHAVIOR; OSCILLATIONS; PREDICTION; CHEMOSTAT,"Remarkably irregular peaks characterize the dynamics of many plant and animal populations. As such peaks are often associated with undesirable consequences (e.g. pest outbreaks, epidemics, forest fires), the forecast of the forthcoming peak is a problem of major concern. Here we show, through the analysis of a number of models and of some of the longest and most celebrated ecological time-series, that the intensity of the forthcoming peak can often be predicted simply from the previous peaks. When this is possible, one can also predict the time of occurrence of the forthcoming peak.",,,,"Casagrandi, Renato/A-1521-2009; Casagrandi, Renato/L-3985-2013","Casagrandi, Renato/0000-0001-5177-803X",,,,,10,11,0,5,,,,1461-023X,,,ECOL LETT,Ecol. Lett.,NOV,2001,4,6,,,,,610,617,,10.1046/j.1461-0248.2001.00273.x,,,,Ecology,,,WOS:000172341500014,,,,,
J,"Salman, AZ; Al-Karablieh, EK",,,,"Salman, AZ; Al-Karablieh, EK",,,An early warning system for wheat production in low rainfall areas of Jordan,JOURNAL OF ARID ENVIRONMENTS,,,English,Article,,,,,,wheat; forecasting model; accumulated monthly rainfall,,"The objective of this study was to construct forecasting models using climatic parameters such as accumulated rainfall, average monthly temperatures and cultivated area, which could predict, at an early stage of the growing season, the expected level of domestic wheat production in low rainfall areas. The translog function showed the best prediction capability among different models. The model was constructed based on past records of the accumulated rainfall during the growing season up to December and up to January. The results indicated that it is possible to predict wheat production in low rainfall area using only the rainfall, temperature and area data available in the earlier months of the growing season. Analysis showed that rainfall was the major factor in increasing wheat production. Interestingly, yield predictions made at the end of January, i.e. including the rainfall in January, are no better than those made at the end of December. An additional 10-mm precipitated in December or January will increase wheat production by 6(.)2 % and 13(.)1 %, respectively. As these predictions can be made at the end of December, the decision-makers should have sufficient time to draw-up the necessary programme of imports. (C) 2001 Academic Press.",,,,"Al-Karablieh, Emad K./C-1826-2015; Salman, Amer/C-3020-2015","Al-Karablieh, Emad K./0000-0002-9721-5109; Salman, Amer/0000-0002-9798-9681",,,,,3,4,0,3,,,,0140-1963,1095-922X,,J ARID ENVIRON,J. Arid. Environ.,NOV,2001,49,3,,,,,631,642,,10.1006/jare.2001.0799,,,,Ecology; Environmental Sciences,,,WOS:000172194700016,,,,,
J,"Lindblad, M",,,,"Lindblad, M",,,Development and evaluation of a logistic risk model: Predicting frit fly infestation in oats,ECOLOGICAL APPLICATIONS,,,English,Article,,,,,,"action threshold; cost/benefit analysis; frit fly; logistic risk model; oats, infestation; Oscinella frit; pesticide use",PEST-MANAGEMENT; OSCINELLA-FRIT; DECISION-MAKING; REGRESSION; CEREALS,"Forecasting insect pest damage allows for an adjustment of pesticide use to the actual need, and it is important to establish the potential benefits of pest forecasts in terms of profitability and reduction of pesticide use. Here I calibrate and evaluate a risk algorithm for frit fly infestation in spring-sown oats, aiming to improve damage forecasts and assess the profitability of different control strategies with regard to regional infestation prevalence. Oat fields in two regions in Sweden with high and low frequencies of infestation were surveyed for 11 and 13 yr, respectively. The surveyed fields were classified either as infested or noninfested, depending on whether or not the infestation level exceeded the economic threshold. The relation between various risk factors and frit fly damage was examined by logistic regression, and risk points were assigned to significant factors. Regional action thresholds (risk point sums) resulting in the lowest average costs were calculated. In regions where pest outbreaks are common, a control strategy based on the proposed risk algorithm was more profitable than prophylactic or no sprays. The percentage of sprayed fields was reduced to < 50%, compared with routine use of pesticides. In low-risk regions, the profitability of the forecasting strategy and the no-control alternative were similar. The predictive accuracy of the risk algorithm was higher than that of a commonly used degree-day model, especially in regions where the frit fly is a minor pest. Based on these results, I suggest that use of the proposed risk algorithm can enhance the farmer's understanding of the biology of this insect pest, increase profitability, and reduce unnecessary use of pesticides. Long-term monitoring of pest and environmental data can facilitate not only on-farm pest control decisions, but can also provide essential information for developing regional pest control strategies.",,,,,,,,,,3,4,1,16,,,,1051-0761,,,ECOL APPL,Ecol. Appl.,OCT,2001,11,5,,,,,1563,1572,,10.1890/1051-0761(2001)011[1563:DAEOAL]2.0.CO;2,,,,Ecology; Environmental Sciences,,,WOS:000171417700024,,,,,
J,"Laurance, WF",,,,"Laurance, WF",,,Future shock: forecasting a grim fate for the Earth,TRENDS IN ECOLOGY & EVOLUTION,,,English,Article,,,,,,,BIODIVERSITY; HOTSPOTS,"In recent years, much attention has focused on the potential environmental effects of global climate change, but other anthropogenic impacts might be even more important. A new study by Tilman et A highlights the threat posed to natural ecosystems worldwide by increasing agricultural development. Over the next 50 years, model projections suggest that rates of habitat destruction, water consumption and emission of agricultural pollutants will increase drastically. Such changes will be greatest in developing nations, which sustain a disproportionately large fraction of the Earth's biological diversity.",,,,"Laurance, William F/B-2709-2012","Laurance, William F/0000-0003-4430-9408",,,,,22,26,0,12,,,,0169-5347,,,TRENDS ECOL EVOL,Trends Ecol. Evol.,OCT,2001,16,10,,,,,531,533,,10.1016/S0169-5347(01)02268-6,,,,Ecology; Evolutionary Biology; Genetics & Heredity,,,WOS:000171174800002,,,,,
J,"Baskent, EZ; Wightman, RA; Jordan, GA; Zhai, YH",,,,"Baskent, EZ; Wightman, RA; Jordan, GA; Zhai, YH",,,Object-oriented abstraction of contemporary forest management design,ECOLOGICAL MODELLING,,,English,Article,,,,,,abstraction; forest management; spatial forest modeling; object-oriented design; decision support systems,LANDSCAPE MANAGEMENT,"This paper presents a conceptual object-oriented design (OOD) framework for abstracting forest management design components. The framework for OOD encompassing modularity, encapsulation, interface and inheritance is used to abstract a forest management system in a modular way. We presented that using OOD approaches, a forest management model can be developed generically enough to accommodate various components of forest management modeling. The model framework is flexible and can be updated with relative efficiency, as the system design components are modularized and less independent than those designed with conventional approaches. We identified the basic components and discussed in detail their interface and behavior (functions) in a typical forest management planning process with three distinct modeling approaches; simulation, optimization and meta heuristics. We established OO management design framework which is both generic enough to provide the fundamental services to any types of forest management modeling such as simulation optimization and meta heuristics - however, we demonstrated the latter - and capable of providing specific services such as handling forest development patterns, forming strategies, forecasting and reporting forest changes. We concludes that the OOD approach for abstracting forest management design process allows a great deal of flexibility in constructing flexible, extensible, and adaptable forest management decision support systems tools and provides important information essential for the sustainable management of forested ecosystems. (C) 2001 Elsevier Science B.V. All rights reserved.",,,,,,,,,,9,9,0,6,,,,0304-3800,,,ECOL MODEL,Ecol. Model.,15-Sep,2001,143,3,,,,,147,164,,10.1016/S0304-3800(01)00254-X,,,,Ecology,,,WOS:000171505700001,,,,,
J,"Hortal, J; Lobo, JM; Martin-Piera, F",,,,"Hortal, J; Lobo, JM; Martin-Piera, F",,,Forecasting insect species richness scores in poorly surveyed territories: the case of the Portuguese dung beetles (Col. Scarabaeinae),BIODIVERSITY AND CONSERVATION,,,English,Article,,,,,,dung beetle; generalized linear models; geographic information system (GIS); insect conservation; Portugal; sampling effort; Scarabaeinae; spatial autocorrelation; species richness forecast,FINLAND COLEOPTERA; SOUTH-AFRICA; CONSERVATION; MODEL; AUTOCORRELATION; BIOGEOGRAPHY; ENVIRONMENT; COMMUNITIES; VEGETATION; REGRESSION,"Large-scale biodiversity assessment of faunal distribution is needed in poorly sampled areas. In this paper, Scarabaeinae dung beetle species richness in Portugal is forecasted from a model built with a data set from areas identified as well sampled. Generalized linear models are used to relate the number of Scarabaeinae species in each Portuguese UTM 50 x 50 grid square with a set of 25 predictor variables (geographic, topographic, climatic and land cover) extracted from a geographic information system (GIS). Between-squares sampling effort unevenness, spatial autocorrelation of environmental data, non-linear relationships between variables and an assessment of the models' predictive power, the main shortcomings in geographic species richness modelling, are addressed. This methodological approach has proved to be reliable and accurate enough in estimating species richness distribution, thus providing a tool to identify areas as potential targets for conservation policies in poorly inventoried countries.",,,,"Lobo, Jorge M/E-2309-2013; Hortal, Joaquin/A-1531-2008","Lobo, Jorge M/0000-0002-3152-4769; Hortal, Joaquin/0000-0002-8370-8877",,,,,43,50,0,15,,,,0960-3115,,,BIODIVERS CONSERV,Biodivers. Conserv.,AUG,2001,10,8,,,,,1343,1367,,10.1023/A:1016624500023,,,,Biodiversity Conservation; Ecology; Environmental Sciences,,,WOS:000170159900008,,,,,
J,"Alexander, MA; Eischeid, JK",,,,"Alexander, MA; Eischeid, JK",,,Climate variability in regions of amphibian declines,CONSERVATION BIOLOGY,,,English,Article,,,,,,,NINO-SOUTHERN OSCILLATION; SEA-SURFACE TEMPERATURE; RAIN-FOREST FROGS; EL-NINO; PACIFIC-OCEAN; POPULATION DECLINES; EPIDEMIC DISEASE; MORTALITY; SATELLITE; TRENDS,"We explored the relationship between amphibian declines and climate variations in Colorado (U.S.A.), Puerto Rico, Costa Rica-Panama, and Queensland (Australia) through two sources of dater output from the National Center for Environmental Prediction ""reanalysis system"" and area-averaged station data. The reanalysis system merges observations from airplanes, land stations, satellites, ships, and weather balloons with output from a weather-forecast model to create global fields of atmospheric variables. Station data consisted of temperature and precipitation measured with thermometers and rain gauges at fixed locations. Temperatures were near normal in Colorado when the amphibian declines occurred In the 1970s, whereas in Central America temperatures were warmer than normal, especially during the dry season. The station data from Puerto Rico and Australia indicated that temperatures were above normal during the period of amphibian declines, but reanalysis did not show such a clear temperature signal, Although declines occurred while the temperature and precipitation anomalies in some of the regions were large and of extended duration, the anomalies were not beyond the range of normal variability. Thus, unusual climate, as measured by regional estimates of temperature and precipitation, is unlikely to be the direct cause of amphibian declines, but it may have indirectly contributed to them. Previous researchers have noted that the declines appear to have propagated from northwest to southeast from Costa Rica to Panama and from southeast to northwest in Queensland, Australia, Wind has the potential to transport pathogens that cause amphibian mortality. The mean direction of the near-surface winds tended to parallel the path of amphibian declines from July-October in Central America and from May-July in Australia. The wind direction was highly variable, however, and the propagation rate of amphibian declines was much slower than the mean wind speed. In addition, the most likely pathogen is a chytrid fungus then does not produce desiccation-resistant spores. Thus, if wind is involved in the propagation of amphibian declines, it is through a complex set of processes.",,,,"Alexander, Michael A/A-7097-2013","Alexander, Michael A/0000-0001-9646-6427",,,,,47,51,0,33,,,,0888-8892,,,CONSERV BIOL,Conserv. Biol.,AUG,2001,15,4,,,,,930,942,,10.1046/j.1523-1739.2001.015004930.x,,,,Biodiversity Conservation; Ecology; Environmental Sciences,,,WOS:000170179600020,,,,,
