PT,AU,BA,BE,GP,AF,BF,CA,TI,SO,SE,BS,LA,DT,CT,CY,CL,SP,HO,DE,ID,AB,C1,RP,EM,RI,OI,FU,FX,CR,NR,TC,Z9,U1,U2,PU,PI,PA,SN,EI,BN,J9,JI,PD,PY,VL,IS,PN,SU,SI,MA,BP,EP,AR,DI,D2,EA,PG,WC,SC,GA,UT,PM,OA,HC,HP,DA
J,"Bastiaanssen, WGM; Ali, S",,,,"Bastiaanssen, WGM; Ali, S",,,"A new crop yield forecasting model based on satellite measurements applied across the Indus Basin, Pakistan",AGRICULTURE ECOSYSTEMS & ENVIRONMENT,,,English,Article,,,,,,crop yield forecast; early warning; photosynthesis; light use efficiency; NOAA-AVHRR,RADIATION-USE EFFICIENCY; PHOTOSYNTHETICALLY ACTIVE RADIATION; NET PRIMARY PRODUCTION; LEAF-AREA INDEX; DRY-MATTER PRODUCTION; SPECTRAL REFLECTANCE; PHYTOMASS PRODUCTION; ABSORBED RADIATION; LIGHT INTERCEPTION; SOLAR-RADIATION,"Three existing models are coupled to assess crop development and forecast yield in the largest contiguous irrigation network in the world: the Indus Basin in Pakistan. Monteith's model is used for the calculation of absorbed photosynthetically active radiation (APAR), the Carnegie Institution Stanford model is used for determining the light use efficiency, and the surface energy balance algorithm for land (SEBAL) is used to describe the spatio-temporal variability in land wetness conditions. The new model requires a crop identification map and some standard meteorological measurements as inputs. The conversion of above ground dry biomass into crop yield has been calibrated through harvest indices and the values obtained are compared with the international literature. The computations were executed in a GIS environment using 20 satellite measurements of the advanced very high resolution radiometer (AVHRR) to cover an annual crop rotation cycle. The validation with district data revealed a root mean square error of 525, 616, 551 and 13,484 kg ha(-1) for wheat, rice, cotton and sugarcane yield, respectively. The model performs satisfactorily for wheat, rice and sugarcane, and poorly for cotton. It is expected that the accuracy of the model applied to 1.1 km pixels decreases with the increasing number of crops occurring within a given pixel. Although AVHRR is basically too coarse a resolution for field scale crop yield estimations, the results provides yield predictions to policy makers in Pakistan with a spatial detail that is better than the traditional district level data. The gaps between the average and the maximum yield are 1075 and 1246 kg ha(-1) for wheat and rice, respectively. Future work should rely on the integration of high and low resolution images to estimate field scale crop yields. (C) 2002 Elsevier Science B.V. All rights reserved.",,,,,,,,,,207,245,2,66,,,,0167-8809,1873-2305,,AGR ECOSYST ENVIRON,Agric. Ecosyst. Environ.,MAR,2003,94,3,,,,,321,340,PII S0167-8809(02)00034-8,10.1016/S0167-8809(02)00034-8,,,,"Agriculture, Multidisciplinary; Ecology; Environmental Sciences",,,WOS:000181110000007,,,,,
J,"Levine, JM; D'Antonio, CM",,,,"Levine, JM; D'Antonio, CM",,,Forecasting biological invasions with increasing international trade,CONSERVATION BIOLOGY,,,English,Article,,,,,,,SPECIES RICHNESS,"We used historical data to parameterize species-accumulation models relating international trade to the establishment rates of nonindigenous species in the United States over the past century. We then coupled these relationships with published trade forecasts to predict future invasion rates for insects, plant pathogens, and mollusks. Relationships between the accumulation of non-native species and merchandise imports were reasonably described by log-log and log-linear species-area models and Michaelis-Menten accumulation functions. However, the latter two models produced markedly better fits. When coupled with projected trade forecasts, the log-linear species-area model predicted 16-24% taxon-specific increases in the number of nonindigenous species established in the United States from 2000 to 2020. The Michaelis-Menten model predicted much lower 3-6% increases, but even this meant 115 new insect species and 5 new plant pathogens. These results suggest that the ecological and economic costs associated with human-caused biological invasions may continue to rise substantially over the coming decades.",,,,"Levine, Jonathan/A-7167-2014","Levine, Jonathan/0000-0003-2857-7904",,,,,420,451,4,132,,,,0888-8892,1523-1739,,CONSERV BIOL,Conserv. Biol.,FEB,2003,17,1,,,,,322,326,,10.1046/j.1523-1739.2003.02038.x,,,,Biodiversity Conservation; Ecology; Environmental Sciences,,,WOS:000180846200037,,,,,
J,"Shi, AQ",,,,"Shi, AQ",,,"The impact of population pressure on global carbon dioxide emissions, 1975-1996: evidence from pooled cross-country data",ECOLOGICAL ECONOMICS,,,English,Article,,,,,,population; global warming; carbon dioxide emissions; CO2 emissions projection; cross-country study,CO2 EMISSIONS; ENVIRONMENTAL-QUALITY; ECONOMIC-GROWTH,"In assessing and forecasting the impact of population change on carbon dioxide emissions, most previous studies have assumed a unitary elasticity of emissions with respect to population change, i.e. that a 1% increase in population results in a 1% increase in emissions. This study finds that global population change over the last two decades is more than proportionally associated with growth in carbon dioxide emissions, and that the impact of population change on emissions is much more pronounced in developing countries than in developed countries. The empirical findings are based on a data for 93 countries over the period 1975-1996. (C) 2002 Elsevier Science B.V. All rights reserved.",,,,,,,,,,283,313,1,61,,,,0921-8009,,,ECOL ECON,Ecol. Econ.,FEB,2003,44,1,,,,,29,42,PII S0921-8009(02)00223-9,10.1016/S0921-8009(02)00223-9,,,,Ecology; Economics; Environmental Sciences; Environmental Studies,,,WOS:000181427100003,,,,,
J,"Lee, JHW; Huang, Y; Dickman, M; Jayawardena, AW",,,,"Lee, JHW; Huang, Y; Dickman, M; Jayawardena, AW",,,Neural network modelling of coastal algal blooms,ECOLOGICAL MODELLING,,,English,Article,,,,,,algal blooms; red tides; coastal eutrophication; knowledge-based models; data driven methods; artificial neural networks; real time prediction; water quality modelling; environmental engineering; Hong Kong; Tolo Harbour,FISH CULTURE ZONE; DISSOLVED-OXYGEN,"An artificial neural network (ANN), a data driven modelling approach, is proposed to predict the algal bloom dynamics of the coastal waters of Hong Kong. The commonly used back-propagation learning algorithm is employed for training the ANN. The modeling is based on (a) comprehensive biweekly water quality data at Tolo Harbour (1982-2000); and (b) 4-year set of weekly phytoplankton abundance data at Lamina Island (1996-2000). Algal biomass is represented as chlorophyll-a and cell concentration of Skeletonema at the two locations, respectively. Analysis of a large number of scenarios shows that the best agreement with observations is obtained by using merely the time-lagged algal dynamics as the network input. In contrast to previous findings with more complicated neural networks of algal blooms in freshwater systems, the present work suggests the algal concentration in the eutrophic sub-tropical coastal water is mainly dependent on the antecedent algal concentrations in the previous 1-2 weeks. This finding is also supported by an interpretation of the neural networks' weights. Through a systematic analysis of network performance, it is shown that previous reports of predictability of algal dynamics by ANN are erroneous in that 'future data' have been used to drive the network prediction. In addition, a novel real time forecast of coastal algal blooms based on weekly data at Lamina is presented. Our study shows that an ANN model with a small number of input variables is able to capture trends of algal dynamics, but data with a minimum sampling interval of 1 week is necessary. However, the sufficiency of the weekly sampling for real time predictions using ANN models needs to be further evaluated against longer weekly data sets as they become available. (C) 2002 Elsevier Science B.V. All rights reserved.",,,,"Lee, Joseph/C-1806-2009",,,,,,167,192,4,62,,,,0304-3800,,,ECOL MODEL,Ecol. Model.,15-Jan,2003,159,3-Feb,,,,,179,201,PII S0304-3800(02)00281-8,10.1016/S0304-3800(02)00281-8,,,,Ecology,,,WOS:000180599300007,,,,,
J,"Rose, KA; Cowan, JH",,,,"Rose, KA; Cowan, JH",,,"Data, models, and decisions in US Marine Fisheries management: Lessons for ecologists",ANNUAL REVIEW OF ECOLOGY EVOLUTION AND SYSTEMATICS,,,English,Review,,,,,,forecasting; communication; uncertainty; Sustainable Fisheries Act; population dynamics,REFERENCE POINTS; STOCK ASSESSMENT; UNCERTAINTY; CONSERVATION; ECOSYSTEMS; COASTAL; COLLAPSE; TARGETS; RISK; FISH,"Ecological and fisheries approaches to population modeling share many common tools and issues, yet they have developed quite independently over the past decades. The Sustainable Fisheries Act has pushed fisheries modeling into forecasting for management decision-making, which is an area where ecological modeling appears to be headed. We summarize how marine fisheries are managed in the United States, and how data and models are used to make the required forecasts. The recent management deliberations of red grouper in the Gulf of Mexico provide a case study of the sensitive relationship among data, models, and management decisions. We use the U.S. marine fisheries experience and the case study to discuss six lessons that ecologists should consider as they proceed toward forecasting for management. The need for forecasting is accelerating both in ecology and fisheries, while the margin for mistakes is getting smaller.",,,,,,,,,,34,38,1,22,,,,1543-592X,,,ANNU REV ECOL EVOL S,Annu. Rev. Ecol. Evol. Syst.,,2003,34,,,,,,127,151,,10.1146/annurev.ecolsys.34.011802.132423,,,,Ecology; Evolutionary Biology,,,WOS:000220102000006,,,,,
B,"Boersma, L; Baham, J",,"Alsharhan, AS; Wood, WW; Goudie, AS; Fowler, A; Abdellatif, EM",,"Boersma, L; Baham, J",,,Aspects of the role of biogeochemical processes in soils in the global carbon cycle,DESERTIFICATION IN THE THIRD MILLENNIUM,,,English,Proceedings Paper,Desertification Conference Toward Better Management of Arid and Semi-Arid Lands in the 21st Century,"FEB 12-16, 2000","DUBAI, U ARAB EMIRATES",,,,ATMOSPHERIC CO2; CALCIUM-OXALATE; TREE ROOTS; CLIMATE; ROCK; FOREST; DIOXIDE; PLANTS; BUDGET; MODEL,"The average global temperature has been slowly rising during recent decades (Jones et al., 2001) and observed expansion of desertification is attributed, in part, to this temperature rise. Governments of many countries are deeply interested in the processes that drive the temperature increase and the rate of increase, for the purpose of being able to predict future conditions. Large investments. are being made in development and application of mathematical models that can be used to predict future temperature increase and to evaluate measures that can arrest the increase. The models account for the interacting exchange processes between the atmosphere, land, oceans and icefields. Uncertainty in the forecasts arises from uncertainty about the processes represented by the models (Weaver and Zwiers, 2000). The carbon dioxide (CO2) in the atmosphere is considered to be an important contributor to the temperature increase because of its ability to trap long wave radiation coming from the Earth's surface. Thus global warming is associated with the increase in CO2 concentration observed during the past century. In this paper we call attention to the importance of biogeochemical processes of soil ecosystems and to the need to incorporate details of the physical and chemical steps in the mathematical forecasting models. The chemical weathering of carbonate-silicate rocks is one of the principal pathways by which CO2 can be taken from the air over long-term, multimillion year timescales. The weathering steps and therefore the rate of carbon removal from the atmosphere depend very much on the rate of plant growth. We introduce three examples of geochemical processes in the space available to us. Geochemical processes influence the global carbon cycle, and thus, climate change. Here we examine the contributions of the geochemical processes which occur in soil ecosystems. It has been observed that the terrestrial ecosystems of the mid-latitude in the Northern Hemisphere take up and store significant amounts of carbon each year. The phenomenon was first reported by Tans et al. (1990) and later confirmed by Ciasis et al. (1995). This observation suggests that the relation between recently observed global warming trends and the increasing cor centration of carbon dioxide in the atmosphere is more complicated than implied by the emphasis on contributions from burning fossil fuels. Evaluation of the distribution of the landmasses on the globe shows that a large fraction of the total land mass is at the mid-latitude of the Northern Hemisphere., Thus, it is logical to look for the hypothesized soil ecosystem sink in the Northern Hemisphere. Identification of the mechanisms that could drive such a sink is important. We suggest that the mechanisms responsible for the sink could be leaching of dissolved inorganic carbon from soils to groundwater which could in turn carry the carbon to rivers and finally to the, oceans where precipitation occurs, and/or processes which extract the carbon from the air as a result of dissolution of carbonate and silicate rocks. Products from this dissolution are also carried to the oceans where carbonates are precipitated. We show examples of current biogeochemical processes in soil ecosystems and note that these processes continue to make a powerful contribution to the global carbon cycle.",,,,,,,,,,0,0,0,10,,,,,,90-5809-571-1,,,,2003,,,,,,,253,261,,,,,,"Ecology; Environmental Sciences; Geography, Physical; Meteorology & Atmospheric Sciences",,,WOS:000184355600026,,,,,
B,"Reynolds, R; Reheis, M; Hinkley, T; Tigges, R; Clow, G; Lamothe, P; Yount, J; Meeker, G; Chavez, P; Mackinnon, D; Velasco, M; Sides, S; Soltesz, D; Lancaster, N; Miller, M; Fulton, R; Belnap, J",,"Alsharhan, AS; Wood, WW; Goudie, AS; Fowler, A; Abdellatif, EM",,"Reynolds, R; Reheis, M; Hinkley, T; Tigges, R; Clow, G; Lamothe, P; Yount, J; Meeker, G; Chavez, P; Mackinnon, D; Velasco, M; Sides, S; Soltesz, D; Lancaster, N; Miller, M; Fulton, R; Belnap, J",,,"Dust emission and deposition in the Southwestern United States - Integrated field, remote sensing, and modeling studies to evaluate response to climatic variability and land use",DESERTIFICATION IN THE THIRD MILLENNIUM,,,English,Proceedings Paper,Desertification Conference Toward Better Management of Arid and Semi-Arid Lands in the 21st Century,"FEB 12-16, 2000","DUBAI, U ARAB EMIRATES",,,,OWENS DRY LAKE; MOJAVE DESERT; PEDOGENIC PROCESSES; SOUTHERN NEVADA; WIND EROSION; CALIFORNIA; SOILS; AEROSOLS; PARTICLES; NORTHERN,"Geomorphic processes in and regions are particularly sensitive to climatic variability. In this context, integrated studies are being conducted to understand the response of dust emission and deposition to climatic and land-use change in the and southwestern United States. Several approaches are taken to monitor wind erosion and characterize modem dust - its sources, flux, and composition - to document the potential for desertification under future climatic conditions. Wind erosion is monitored at ecologically sensitive sites, using meteorological stations that measure sand flux within the saltation layer. Dust deposition is also monitored at these and many other sites using different types of dust collectors. In addition, new remote sensing methods detect the location, frequency, magnitude, and duration of large dust-emission events. Remotely sensed images of vegetation change, combined with those that illustrate high soil reflectivity, complement dust-detection methods to identify areas especially susceptible to wind erosion. Dust trapped in collectors and in snow is characterized for its physical, mineralogic, and chemical properties. Combined with soil and weather data, such characterization sheds light on: (1) the relation between dust storms and synoptic climatic conditions; (2) the importance of Owens (dry) Lake (California) as a dominant source of southwestern U.S. dust, for as much as 400 km downwind; (3) the impacts of human disturbances in the desert, revealed by signatures of agricultural and construction dust; and (4) the composition and flux of regional background dust composition and flux. Past dust flux is studied from late Quaternary eolian deposits, partly using a new combination of magnetic and chemical methods developed to recognize eolian dust in soils and surficial deposits over large regions. Such studies have applications to understanding current plant distribution, substrates for biologic soil crust, and paleoenvironmental histories of ecosystems. A wind-erosion model based on wind strength, atmospheric shear stress on the surface, and atmospheric stability is being developed. This model will be constrained by remote sensing and ground-based observations and will then be linked with a regional climate model and interactive vegetation package to forecast how various climatic and land-use scenarios interact with critical wind speeds required to move surface materials. We will attempt to answer the following questions: How does wind strength vary with natural climate cycles on decadal and century time scales? To what extent will winds become stronger or weaker under future climate scenarios? How have soil moisture and vegetation changes affected wind erosion in the past, and what can we expect in the future? As an example of possible future conditions, projections of doubled atmospheric CO2 (above pre-industrial levels) for the southwestern U.S. suggest a decrease in winter soil moisture, which may enhance wind erosion.",,,,,,,,,,11,11,0,10,,,,,,90-5809-571-1,,,,2003,,,,,,,271,282,,,,,,"Ecology; Environmental Sciences; Geography, Physical; Meteorology & Atmospheric Sciences",,,WOS:000184355600028,,,,,
B,"Elagib, AAR",,"Alsharhan, AS; Wood, WW; Goudie, AS; Fowler, A; Abdellatif, EM",,"Elagib, AAR",,,Can science and technology help to initiate natural regreening of the Arabian peninsula?,DESERTIFICATION IN THE THIRD MILLENNIUM,,,English,Proceedings Paper,Desertification Conference Toward Better Management of Arid and Semi-Arid Lands in the 21st Century,"FEB 12-16, 2000","DUBAI, U ARAB EMIRATES",,,,VEGETATION; MODEL; RAINFALL,"Accumulated archeological, historical and cultural evidence indicates that the Arabian Peninsula has experienced many rainy periods when valleys were green and old streams were running. This was experienced even during the recent geological period, i.e. the Holocene. Radiocarbon tests show that even below the sands of the Empty Quarter, there are existing signs of recent periods of greenery (McClure, 1976; UNEP, 1977, p. 109). The Arabic language has a wealth of synonyms for the word ""lion"" and other Savannah animals proving that favourable climates existed even after the present-day version of the Arabic language has been in practice in Arabia. Such facts and findings consolidate the idea that the basic topography of the Peninsula does not present an inhibitive permanent barrier to favourable climates, (Elagib et al., 1990). Ironically to-day deserts and dry lands cover over 90% of the peninsula, even though its climate is dominated by two normally powerful moisture bearing wind systems which are renowned for their effectiveness if they find welcoming ecosystems. These are the Mediterranean type moist winds that frequent the northern and eastern parts of the peninsula during winter, and the monsoons that cause rainfall over the southwestern parts during summer. Experiences drawn from the recent episodes of drought in Africa and scientific observations show that such adverse conditions of drought and desertification happen in the mainland when the canopy of rain forests in the path of the rain currents entering the main land are stripped or degraded. The forests canopy, if existing, would hold most of the rainwater in the foliage thus helping it to re-evaporate, and advance as clouds to the main land (Hare and Lettau in UNEP, 1977; Elagib, 1986). In addition to this phenomenon, forests are known to provide favourable ecosystems and microclimates, which attract more precipitation and stabilise the frequency of rainfall. The advantage availed by the canopy phenomenon is that rehabilitation can start at the canopy end where rain is still available and not inland where water is scarce. Global (or general) Climate Circulation Models, usually denoted by GCM's. are well known since the 1960's. However, it is only recently that the dynamics of the plant and vegetation cover (the Biosphere in general) have been included in interactive modelling (McGuffie and Henderson-Sellers, 1977; Sud et al., 1993 and Eltahir, 1996). The objective of this experiment is to develop several scenarios simulating the past (or possible) natural greenery in the Peninsula and what could have been (or should be) the prevailing ambient environmental conditions and ecosystems in, and around, the Peninsula (namely both the climatological and the ecological conditions). It is suggested that these scenarios be developed through the above-cited experiences with interactive models. These models were very useful in evaluation of the negative effects of deforestation on climate change, global warming and drought. The challenge here is to use them to make innovative possible plans for afforestation in the form of favourable grids of forest canopies and ecosystems which may help to attract more precipitation and deploy inland richer rain currents, and hence initiate the process of natural re-greening, because rains provide the-natural elements of regeneration and reversal of desertification. It is noted that most of the present projects dealing with desertification are no more than projects aiming at a happier mode of coexistence with the deserts. The significance of this experiment is that it provides the chance to utilise the overwhelming scientific innovations and technologies that Man has wielded to design long term plans to combat and to reverse desertification. The techniques of modelling can now avail the opportunities to assess the viability of these long term plans and projects at desktop and at little cost, where otherwise there is no degree of certainty about their long term out-come. The immense information from remote sensing imagery, satellite archives and GIS provide the tools for parameterisation of the models and forecast of projections.",,,,,,,,,,1,1,0,0,,,,,,90-5809-571-1,,,,2003,,,,,,,399,405,,10.1201/NOE9058095718.ch43,,,,"Ecology; Environmental Sciences; Geography, Physical; Meteorology & Atmospheric Sciences",,,WOS:000184355600043,,,,,
S,"Pietrafesa, LJ; Xie, L; Dickey, DA; Peng, MC; Yan, S",,"Tiezzi, E; Brebbia, CA; Uso, JL",,"Pietrafesa, LJ; Xie, L; Dickey, DA; Peng, MC; Yan, S",,,The North Carolina State University coastal and estuary storm surge and flood prediction system,"ECOSYSTEMS AND SUSTAINABLE DEVELOPMENT IV, VOLS 1 AND 2",ADVANCES IN ECOLOGICAL SCIENCES,,English,Proceedings Paper,4th International Conference on Ecosystems and Sustainable Development,"JUN 04-06, 2003","SIENA, ITALY",,,,MODEL,"The North Carolina State University Coastal and Estuary Marine & Environmental Prediction System (CEMEPS) is a coupled system of mathematical models. CEMEPS contains a suite of interactively linked atmospheric, oceanic, estuary and river model components. The model architecture couples mesoscale atmospheric models or event models such as hurricanes or a suite of atmospheric variable measurements, wind-fields and precipitation, to ocean basin, continental margin, and estuary hydrodynamic models to a river discharge-interaction model. So, winds and precipitation are both observed and modeled and water waves and currents and water levels are predicted. Thus,storm surge and estuary flooding can be accurately determined well in advance of a storm. CEMEPS output is routinely used by the North Carolina Office of the National Weather Service to make forecasts of coastal and estuary flooding during the passage of Tropical and Extra-Tropical Cyclones. While the model system is currently focused on the coasts of the Carolinas, CEMEPS could be ported to all coasts. The goal of CEMEPS is to improve the capacity of coastal communities to reduce flood impacts.",,,,,,,,,,3,3,0,1,,,,1369-8273,,1-85312-834-1,ADV ECOL SCI,Adv. Ecol. Sci.,,2003,18-19,,,,,,101,109,,,,,,Ecology; Environmental Sciences; Environmental Studies; Regional & Urban Planning,,,WOS:000185615100010,,,,,
