PT,AU,BA,BE,GP,AF,BF,CA,TI,SO,SE,BS,LA,DT,CT,CY,CL,SP,HO,DE,ID,AB,C1,RP,EM,RI,OI,FU,FX,CR,NR,TC,Z9,U1,U2,PU,PI,PA,SN,EI,BN,J9,JI,PD,PY,VL,IS,PN,SU,SI,MA,BP,EP,AR,DI,D2,EA,PG,WC,SC,GA,UT,PM,OA,HC,HP,DA
S,"Thomas, RG",,"Benaka, LR",,"Thomas, RG",,,Fish habitat and coastal restoration in Louisiana,FISH HABITAT: ESSENTIAL FISH HABITAT AND REHABILITATION,American Fisheries Society Symposium,,English,Proceedings Paper,Sea Grant Symposium on Fish Habitat - Essential Fish Habitat and Rehabilitation at the 1998 Annual Meeting of the American-Fisheries-Society,"AUG 26-27, 1998","HARTFORD, CT",,,,BROWN SHRIMP; WETLAND LOSS; SEA-LEVEL; SEDIMENT DEPOSITION; PENAEUS-AZTECUS; SALT-MARSH; MANAGEMENT; WATER; USA; IMPOUNDMENTS,"The magnitude of changes occurring in Louisiana's estuaries creates a unique set of challenges in fish habitat management. Louisiana leads the nation in rate of coastal land loss, with some 70% of national losses. Both natural and anthropogenic factors are involved in coastal land loss in Louisiana: subsidence, erosion, sediment and freshwater deficits, channelization, and rising mean sea level. Disruption of the natural deltaic cycles of the Mississippi River has been particularly detrimental to estuarine fish habitat. Navigation and flood control needs have resulted in the near-total leveeing of the river, preventing normal overbank flooding, channel filling and switching, delta and subdelta development, and sediment nourishment of adjacent and down-current marshes. The resulting system is one in which the quantity and quality of estuarine habitat are linked to rapidly degrading wetland environments. Although the relative production value of subsiding marsh surfaces is often very high, this condition is not sustainable. Steep declines in fish production have been forecast for the next century. Federal, state, and local coastal restoration projects are attempting to address the loss of estuarine habitat with a number of techniques that may produce localized changes in fisheries production and distributions. Temporary resource displacements can result in increased harvest costs, and basin-scale changes may be particularly hard to accept for resource users who are satisfied with current conditions. Harvesters have demonstrated reluctance, and may lack the financial flexibility, to forfeit expected current catches for predicted enhancement of long-term fisheries production. In some instances, both sportfishers and commercial resource users have expressed concern over estuarine freshening and turbidity from restoration inputs from riverine sources. Additional public perception difficulties with restoration efforts arise from misunderstandings of the nature of estuarine functions, particularly of the importance of nursery habitat and of the value of low-salinity marshes as nursery habitat. Significant improvement in the outlook for estuarine fish habitat in Louisiana will require long-term and large-area vision from resource managers and the public.",,,,,,,,,,5,5,0,10,,,,0892-2284,,1-888569-12-3,AM FISH S S,Am. Fish. Soc. Symp.,,1998,22,,,,,,240,251,,,,,,Ecology; Fisheries; Marine & Freshwater Biology; Oceanography,,,WOS:000082192300018,,,,,
S,"Lind, T",,"Nabuurs, GJ; Nuutinen, T; Bartelink, H; Korhonen, M",,"Lind, T",,,Quantifying the area of edge zones in Swedish forest to assess the impact of nature conservation on timber fields,FOREST SCENARIO MODELLING FOR ECOSYSTEM MANAGEMENT AT LANDSCAPE LEVEL,EUROPEAN FOREST INSTITUTE PROCEEDINGS,,English,Proceedings Paper,International Seminar and Summer School on Forest Scenario Modelling for Ecosystem Management at Landscape Level,"JUN 26-JUL 03, 1997","WAGENINGEN, NETHERLANDS",,,,MANAGEMENT,"The new Swedish Forestry Act states that the forests should be sustainably managed in a profitable way and, at the same time, the current levels of biodiversity should be maintained. This and the pressure from consumers for forest products to be produced in a way which protects biodiversity has changed forestry towards a more nature oriented management. An estimation of the effects of this nature conservation on timber yields and potential cut must be included in forest scenario modelling to assess the long-term impacts. An important component of preserving biodiversity in forests in this nature oriented management is to adjust management measures in edge zones adjacent to mires, riparian zones, non-productive hills, etc. Examples of management measures in edge zones are no cutting, modified thinning, single tree selection or leaving behind large trees. These spatial considerations can now be dealt with in long-term forecasts using HUGIN, a system based on sample plot data from the Swedish National Forest Inventory (NFI). This is because of the improved description of the context of the NFI sample plots in the landscape. Furthermore, geographical positions are determined using the Global Positioning System (GPS), which facilitates the combination of NFI data with other data sources. A schedule of how to select sample plots located in forest habitats that are valuable for biodiversity is shown. Analyses of the new NFI data show that approximately ii % of the productive forest land is located within 25 meters of mires and non-productive hills and 3 % is located in riparian zones. Forest scenario modelling using the HUGIN system will now be able to estimate the reductions in the long-term potential cut due to nature conservation in edge zones.",,,,,,,,,,0,0,0,0,,,,1237-8801,,952-9844-40-9,EUR FOREST INST PROC,,,1998,,19,,,,,265,276,,,,,,Ecology; Forestry,,,WOS:000078875700018,,,,,
S,"Giers, A; Freistuhler, E; Schultz, GA",,"Kovar, K; Tappeiner, U; Peters, NE; Craig, RG",,"Giers, A; Freistuhler, E; Schultz, GA",,,Methodology for assessment of ecohydrological effects of dam construction in a headwater region,"HYDROLOGY, WATER RESOURCES AND ECOLOGY IN HEADWATERS",IAHS PUBLICATION,,English,Proceedings Paper,HeadWater 98 Conference,"APR 20-23, 1998","MERANO, ITALY",,,,,"For the assessment of ecohydrological effects of dam construction in headwater regions an evaluation method is presented based on the so-called ""ecological risk assessment"". This method allows the determination of the spatially detailed ecological risk for various environmental factors based on the aggregation of two ordinal values: an evaluation of the present ecological state of the area under consideration and its forecast degree of damage. Here we focus on the integration of cause-effect relationships between abiotics and biotics and thus on interdisciplinary cooperation between the fields of civil engineering and ecology. The methodology is implemented in a complex software system. First a geographical information system is used for the management of the spatial database. A computer Expert System will be linked to the GIS, thus allowing an efficient implementation of the evaluation procedure. This way the decision process for finding the ecologically best project alternative is supported.",,,,,,,,,,0,0,0,0,,,,0144-7815,,1-901502-45-7,IAHS-AISH P,,,1998,,248,,,,,509,514,,,,,,"Ecology; Environmental Sciences; Geosciences, Multidisciplinary; Water Resources",,,WOS:000079717200062,,,,,
J,"Lewellen, RH; Vessey, SH",,,,"Lewellen, RH; Vessey, SH",,,Modeling biotic and abiotic influences on population size in small mammals,OECOLOGIA,,,English,Article,,,,,,transfer function analysis; multivariate time series analysis; weather; Peromyscus leucopus; Ricker equation,WHITE-FOOTED MICE; TIME-SERIES; PEROMYSCUS-LEUCOPUS; DENSITY-DEPENDENCE; EXTRA FOOD; DEER MICE; TEMPERATURE; MANICULATUS; DYNAMICS; FOREST,"Most previous work in population ecology has modeled density-dependent effects in isolation. In this paper, we concurrently modeled the effect of density-dependent and density-independent factors on the rate of population change (R-t) in Peromyscus leucopus (white-footed mouse), using a Picker equation expanded to include weather and seasonality. From 1973 to 1996, we live-trapped P. leucopus monthly in a 2-ha Ohio woodlot. Population peaks (July to August) varied from 27 to 181 individuals, while troughs (December to March) varied from 4 to 46 individuals. We used time-delayed densities to act as surrogates for unobserved density-dependent factors, and principal components to represent 12 highly collinear weather variables. We identified time-delayed correlations by season between R-t and the independent variables (i.e., previous densities and weather principal components) using transfer function analysis. In summer, when P. leucopus densities were above the seasonal mean for the month, R-t was lower in the following 2 months; however, in winter, R-t was greater in the first but lower in the second succeeding month. R-t also correlated positively in autumn with contemporaneous precipitation, and was negatively correlated with 'extreme' weather in summer with 2- and 3-month lags and in winter with a 3-month lag. We hypothesize that precipitation affected juveniles by influencing food resources and that 'extreme' weather affected breeding. Our model explained 65% of the variability in R-t, and density-dependent and density-independent factors explained an equal percentage of that variability. This model created good forecasts of population density up to 12 months in the future.",,,,,,,,,,27,27,0,12,,,,0029-8549,,,OECOLOGIA,Oecologia,JAN,1998,113,2,,,,,210,218,,10.1007/s004420050370,,,,Ecology,,,WOS:000071658500008,28308199,,,,
J,"Lindstrom, J; Kokko, H; Ranta, E; Linden, H",,,,"Lindstrom, Jan; Kokko, Hanna; Ranta, Esa; Linden, Harto",,,Predicting population fluctuations with artificial neural networks,WILDLIFE BIOLOGY,,,English,Article,,,,,,artificial neural network; forecasting; population dynamics; wildlife management,,"Lindstrom, J., Kokko, H., Ranta, E. & Linden, H. 1998: Predicting population fluctuations with artificial neural networks. - Wildl. Biol. 4: 47-53. Successful predictions of population fluctuations are valuable in game management, as population estimates are instrumental in increasing the time available for management decisions. However, finding a population model which produces predictions accurate enough to be used for management purposes is often precluded due to scarcity and noisiness of population data. Using two long-term population data sets, 1964-1984 data on Finnish grouse (Tetrao urogallus, T. tetrix and Bonasa bonasia) and 1914-1950 data on coloured fox Vulpes fulva from Canada, we demonstrate the use and power of an artificial neural network in predicting population fluctuations. The performance of an artificial neural network model is compared to two benchmark forecasts: time series mean and the previous data value. Unfortunate as it is, in practise management decisions often have to be made with limited data. Therefore, a notable advantage of neural network modelling is the forecast accuracy even in cases when the time series available are short and noisy, and the processes underlying population fluctuations are not fully understood.",,,,,"Lindstrom, Jan/0000-0001-5630-6680",Academy of FinlandAcademy of Finland; Oskar Oflund Foundation,"this study. was funded by the Academy of Finland and Oskar Oflund Foundation. We thank Chris Chatfield for statistical advice, Peter Hudson for comments and Nigel Yoccoz and two anonymous referees for their constructive criticism.",,,1,1,1,4,,,,0909-6396,,,WILDLIFE BIOL,Wildlife Biol.,,1998,4,1,,,,,47,53,,,,,,Ecology; Zoology,,,WOS:000208609900005,,,,,
J,"Mac Nally, R; Bennett, AF",,,,"Mac Nally, R; Bennett, AF",,,"Species-specific predictions of the impact of habitat fragmentation: Local extinction of birds in the box-ironbark forests of central Victoria, Australia",BIOLOGICAL CONSERVATION,,,English,Article,,,,,,abundance; habitat fragmentation; habitat specialization; mobility; rarity,NEST PREDATION; OEDURA-RETICULATA; WOODLAND BIRDS; SMALL MAMMALS; CONSERVATION; LANDSCAPE; SIZE; POPULATIONS; DYNAMICS; PATTERNS,"Habitat fragmentation is an issue of major concern for the conservation of biota in landscapes throughout the world. For resource managers to have a sound basis for making decisions, and for conservation biology to mature as a discipline, we must go beyond case-by-case interpretation and be able to predict with confidence the impacts of fragmentation in a range ofenvironments. The reliable forecasting, for example, of those species that will be most vulnerable to fragmentation in a given environment would facilitate a pro-active approach to the management of habitats at the landscape and regional scale. There is a need for workers to formulate hypotheses that generate testable predictions, which in turn are evaluated and further refined by empirical studies. Such hypothesis testing will be most convincing when specific predictions are made prior to the conduct of a study. The purpose of the current paper is to make just such a priori predictions on the vulnerability of woodland birds to local extinction in the fragmented box-ironbark Eucalyptus microcarpa/E, tricarpa forest region of central Victoria, Australia. The present a simple model based on three characteristics of terrestrial species: mobility, population density and habitat specificity. We outline the model and use existing information about 43 species previously recorded in these forests (and about which we have pertinent information) to construct a graded series of expectations concerning their proneness to local extinction. The design of a study to test these predictions also is described. (C) 1997 Published by Elsevier Science Ltd.",,,,"Mac Nally, Ralph/A-5262-2008",,,,,,39,42,0,14,,,,0006-3207,,,BIOL CONSERV,Biol. Conserv.,NOV,1997,82,2,,,,,147,155,,10.1016/S0006-3207(97)00028-1,,,,Biodiversity Conservation; Ecology; Environmental Sciences,,,WOS:A1997XR66900004,,,,,
J,"Boyle, TP; Fairchild, JF",,,,"Boyle, TP; Fairchild, JF",,,The role of mesocosm studies in ecological risk analysis,ECOLOGICAL APPLICATIONS,,,English,Article,,,,,,"ecological inertia; ecological resilience; ecosystem structure and vulnerability; fate and effects models; indirect effects of xenobiotics; mesocosm experiments; pesticides; resource management, regional framework; risk analysis",AQUATIC MESOCOSMS; COMMUNITY STRUCTURE; TROPHIC CASCADES; ECOSYSTEMS; LEVEL; LAKE,"Mesocosms have been primarily used as research tools for the evaluation of the fate and effects of xenobiotic chemicals at the population, community, and ecosystem levels of biological organization. This paper provides suggestions for future applications of mesocosm research. Attention should be given to the configuration of mesocosm parameters to explicitly study regional questions of ecological interest. The initial physical, chemical, and biological conditions within mesocosms should be considered as factors shaping the final results of experiments. Certain fundamental questions such as the ecological inertia and resilience of systems with different initial ecological properties should be addressed. Researchers should develop closer working relationships with mathematical modelers in linking computer models to the outcomes of mesocosm studies. Mesocosm tests, linked with models, could enable managers and regulators to forecast the regional consequences of chemicals released into the environment.",,,,"McLean, Laurence JA/C-7367-2014",,,,,,31,32,1,13,,,,1051-0761,,,ECOL APPL,Ecol. Appl.,NOV,1997,7,4,,,,,1099,1102,,,,,,Ecology; Environmental Sciences,,,WOS:A1997YD79000004,,,,,
J,"Beerling, DJ; Woodward, FI; Lomas, M; Jenkins, AJ",,,,"Beerling, DJ; Woodward, FI; Lomas, M; Jenkins, AJ",,,Testing the responses of a dynamic global vegetation model to environmental change: a comparison of observations and predictions,GLOBAL ECOLOGY AND BIOGEOGRAPHY LETTERS,,,English,Article,,,,,,boreal vegetation; global environmental change; hydrology; photosynthesis; vegetation models,GAS-EXCHANGE RESPONSES; ATMOSPHERIC CO2; BOREAL VEGETATION; WHOLE-CATCHMENT; CARBON BALANCE; CLIMATE-CHANGE; ELEVATED CO2; FOREST; SCALE; TEMPERATURE,"Dynamic global vegetation - biogeochemistry models are required to predict the likely responses of the terrestrial biosphere to anticipated future global environmental change and for improved representation of an active vegetation surface within general circulation models of the Earth's global climate system. Testing the predictions of such models is essential to their development prior to use in a predictive capacity. The climate change experiment (CLIMEX) has exposed an entire catchment of boreal vegetation to elevated CO2 (560 ppmv) and temperature (+3 degrees C in summer, +5 degrees C in winter) for the past three years and has a considerable archive of pre-and posttreatment measurements of both CO2 and water vapour fluxes of the vegetation, catchment runoff and soil nutrient status. These data have been used to test the predictions of the University of Sheffield dynamic global vegetation model (SDGVM) for the same site using historical records of climate as input. Comparisons of observations and predictions at the scale of individual leaves and whole ecosystems are generally favourable, increasing our confidence in the application of the model to forecasting the responses of the terrestrial biosphere to various global change scenarios. The SDGVM has been used to predict the future responses of the ecosystem at the site into the year 2003AD. The results indicate rather small changes in leaf area index and catchment runoff but quite large increases in net primary productivity. The model predictions are now open to testing further as the CO2 and temperature treatments continue in the CLIMEX greenhouse.",,,,"Jenkins, Alan/I-8742-2012; Woodward, Frank Ian/P-4530-2019; Woodward, Ian F/B-7762-2008; Beerling, David/C-2840-2009","Beerling, David/0000-0003-1869-4314",,,,,42,45,1,17,,,,0960-7447,,,GLOBAL ECOL BIOGEOGR,Glob. Ecol. Biogeogr. Lett.,NOV,1997,6,6,,,,,439,450,,10.2307/2997353,,,,"Ecology; Geography, Physical",,,WOS:000072268000004,,,,,
J,"Varis, O; Kuikka, S",,,,"Varis, O; Kuikka, S",,,Joint use of multiple environmental assessment models by a Bayesian meta-model: the Baltic salmon case,ECOLOGICAL MODELLING,,,English,Article,,,,,,Bayesian statistics; decision analysis; fisheries management; forecasting; precautionary principle; risk analysis; uncertainty,BELIEF NETWORKS; INFORMATION,"An approach to construct a meta-modeling framework using Bayesian calculus is presented. It allows the inclusion of several - both causal and empirical - models in a Bayesian belief network that is capable of real-time updating of uncertainties in the system. The approach can be used for diagnosis and forecasting purposes. It is illustrated with the assessment problem of the threatened, wild salmon stocks in the Baltic Sea. As usual, the institutions responsible for the management are prone to accept well-known standard assessment models. In this case, the Virtual Population Analysis approach and a set of regression models have been used. A debate on possible superiority of one or more of these models over the others is met at each annual international negotiation among stock assessment experts. The need has arisen to develop a methodology that would allow analytic fusion of these models to learn from the properties of the models and from the problem setting in general, as well as to facilitate probabilistic predictions that would utilize as much of the available information as possible. Moreover, the probabilistic approach is very compatible with and supportive to the use of the precautionary principle (risk-averse attitude). The belief network approach has shown appropriateness for handling of this type of problem in environmental and resource management. (C) 1997 Elsevier Science B.V.",,,,"Varis, Olli/G-6506-2011","Varis, Olli/0000-0001-9231-4549",,,,,40,42,3,11,,,,0304-3800,,,ECOL MODEL,Ecol. Model.,29-Oct,1997,102,3-Feb,,,,,341,351,,10.1016/S0304-3800(97)00068-9,,,,Ecology,,,WOS:A1997YG56200011,,,,,
J,"Webster, JPG",,,,"Webster, JPG",,,Assessing the economic consequences of sustainability in agriculture,AGRICULTURE ECOSYSTEMS & ENVIRONMENT,,,English,Article; Proceedings Paper,Symposium on Integrated Crop Protection - Towards Sustainability,"SEP 11-14, 1995","HERIOT-WATT UNIV, EDINBURGH, SCOTLAND",,HERIOT-WATT UNIV,sustainability; agriculture; rural; farm systems; economy,,"In many developed economies, the mainly non-agricultural population shows concern for the management of the rural environment and there is increasing interest in the concept of sustainability. Public pressure manifests itself in many ways, including the demand for adjustments to agricultural support systems which may include elements of cross-compliance or modifications to the economics of farming systems, which in turn lead managers to reduce inputs. Better knowledge on the part of such managers in relation to the complexities of the environmental management of their crops may allow them to maintain gross margins at reduced levels of inputs and yields. Such changes, whilst maintaining farm incomes, may reduce the demand for inputs, including labour. Research results tend to be location-specific so, with highly variable ecologies across regions, it is very difficult to forecast the regional economic impacts of the adoption of sustainable systems. At the national level, aggregate reductions in the production of some commodities would assist in the achievement of the GATT agreements to reduce subsidised exports. There may also be changes to the comparative advantage of different regions across Europe. (C) 1997 Elsevier Science B.V.",,,,,,,,,,23,26,0,13,,,,0167-8809,,,AGR ECOSYST ENVIRON,Agric. Ecosyst. Environ.,JUL,1997,64,2,,,,,95,102,,10.1016/S0167-8809(97)00027-3,,,,"Agriculture, Multidisciplinary; Ecology; Environmental Sciences",,,WOS:A1997XX78800002,,,,,
J,"Thapliyal, V",,,,"Thapliyal, V",,,Preliminary and final long range forecast for seasonal monsoon rainfall over India,JOURNAL OF ARID ENVIRONMENTS,,,English,Article,,,,,,Indian monsoon; seasonal rainfall; long range forecast; preliminary and final forecast; Parametric and Power Regression model; Dynamic Stochastic Transfer model; stability of predictors; sensitivity of forecast,OSCILLATION,"India was the first country to begin systematic work on Long Range Forecasting (LRF) of seasonal rainfall, particularly the south-west monsoon rainfall during June to September which accounts for 80% of the country's annual rainfall and has a dominant impact on its socio-economic environment. The first operational LRF for seasonal monsoon rainfall over the country as a whole was issued by the India Meteorological Department (IMD) on 4 June 1886. In India, the correlation method was introduced in the first decade of this century, as an objective LRF technique. Subsequently, several forecast techniques were developed for improving the accuracy of the forecast. Presently, four LRF models, namely Parametric, Power Regression, Multiple Regression and Dynamic Stochastic Transfer are being used to issue a rainfall forecast over the whole country. The first three models use correlation as the basis while the fourth assumes that the atmosphere is a dynamic system which transfers various inputs into output such as rainfall. These models generally use different combinations of 16 land-ocean-atmospheric parameters (predictors) which appear to have physical links with the evolution of subsequent monsoon over India. For India as a whole, the monsoon rainfall forecast is issued in two stages. In the first stage, a preliminary forecast is issued in qualitative form towards the end of March or early April. In the second stage, the final forecast is issued in quantitative form towards the end of May. In this paper, LRF models which are used for issuing the final monsoon rainfall forecast are discussed in detail. For the first time, stability of the monsoon relationship with different parameters is analysed. It shows that in order to overcome epochal fluctuations in the relationship, the forecast model should be revised every year. An attempt is also made to analyse the influence of individual parameters on model forecast. Final quantitative forecasts, based on these models, have all proved to be accurate during the past successive 4 years (1989-1992). An attempt is also made to develop a few LRF models that can be used for issuing a preliminary monsoon rainfall forecast, in qualitative form, at least 2 months ahead of the final forecast. For this purpose, eight parameters out of the 16 which are available by the end of March have been utilised for developing preliminary Parametric, Power Regression, Multiple Regression and Dynamic Stochastic Transfer models. Results obtained from all the four preliminary models are analysed. Recognising the limitations of statistical models for producing very early monsoon forecast, it has been found appropriate that the preliminary monsoon forecasts are issued to users in qualitative form and not in quantitative form. While formulating a qualitative forecast, inferences obtained from different models are given due weightage. Preliminary forecasts issued based on these models have proved accurate during the past 5 successive years (1988-1992) and have become popular among different kinds of users. (C) 1997 Academic Press Limited.",,,,,,,,,,25,26,0,0,,,,0140-1963,,,J ARID ENVIRON,J. Arid. Environ.,JUL,1997,36,3,,,,,385,403,,10.1006/jare.1996.0233,,,,Ecology; Environmental Sciences,,,WOS:A1997XJ42200001,,,,,
